Goal ID,Impact Area,Goal Description,Impact Metric,Target Number,Midway Reporting (June 2025 - October 2025),Endline Reporting (total June 2025-February 2026),% of KPI Achieved,No longer Applicable,Later Stages -->,Onboarding Due Date,Midway Reporting Due Date,Endline Reporting Due Date,Onboarding Status,Midway Reporting Status,Endline Reporting Status,SUM: Reporting Status,Hidden -->,Level,Child,Status ID,Report,PS Cycle,Project Name,Fellow ID,Fellow Email,Fellow Full Name,VC Name,VC Email,VC Group,Cohort,Region
GOAL,,,,,,,,,,,,,,Outstanding,Outstanding,,,1,,0.0,,Cycle 25-26,BioViL,7647,pankajragmy@gmail.com,Pankaj Sharma,Mark Malhotra,mark.ext@thedoschool.org,C7,Cohort 2 (2024/25),Europe
,Environmental Impact,"By March 30, 2026, we aim to eliminate the burning of about 100 kilograms of firewood.",metric tons of CO2 emissions reduced,10.0,0.0,,0.0,1.0,,,,,Outstanding,Outstanding,Outstanding,,,2,1.0,,GOAL,Cycle 25-26,BioViL,7647,pankajragmy@gmail.com,Pankaj Sharma,Mark Malhotra,mark.ext@thedoschool.org,C7,Cohort 2 (2024/25),Europe
,Project Growth,"By December 2025, we will officially introduce our idea to a recognized organization, ensuring compliance and paving the way for broader adoption.","number of company registrations, patents secured or licenses aquired",1.0,0.0,1.0,1.0,,,,,,Outstanding,Outstanding,Outstanding,,,2,1.0,,GOAL,Cycle 25-26,BioViL,7647,pankajragmy@gmail.com,Pankaj Sharma,Mark Malhotra,mark.ext@thedoschool.org,C7,Cohort 2 (2024/25),Europe
,Social Impact,"By December 2025, we will begin constructing a biodigester on a farm, as previously agreed upon with the landowner.",number of jobs created or experts hired,1.0,1.0,5.0,5.0,,,,,,Outstanding,Outstanding,Outstanding,,,2,1.0,,GOAL,Cycle 25-26,BioViL,7647,pankajragmy@gmail.com,Pankaj Sharma,Mark Malhotra,mark.ext@thedoschool.org,C7,Cohort 2 (2024/25),Europe
,Environmental Impact,"By March 2025, the biodigester will be fully operational, producing biogas.",metric tons of CO2 emissions reduced,1.0,0.0,2.61,2.61,,,,,,Outstanding,Outstanding,Outstanding,,,2,1.0,,GOAL,Cycle 25-26,BioViL,7647,pankajragmy@gmail.com,Pankaj Sharma,Mark Malhotra,mark.ext@thedoschool.org,C7,Cohort 2 (2024/25),Europe
,Social Impact,"By Feb 2025, conduct workshops, train locals to be the operators of the biodigester",number of people trained,2.0,0.0,4.0,2.0,,,,,,Outstanding,Outstanding,Outstanding,,,2,1.0,,GOAL,Cycle 25-26,BioViL,7647,pankajragmy@gmail.com,Pankaj Sharma,Mark Malhotra,mark.ext@thedoschool.org,C7,Cohort 2 (2024/25),Europe
,Environmental,"By March 30, 2026, we aim to eliminate the burning of about 100 kilograms of firewood.",metric tons of CO2 emissions reduced,1.0,,2.64,2.64,,,,,,Outstanding,,Outstanding,,,2,1.0,,GOAL,Cycle 25-26,BioViL,7647,pankajragmy@gmail.com,Pankaj Sharma,Mark Malhotra,mark.ext@thedoschool.org,C7,Cohort 2 (2024/25),Europe
